{
  "schema_version":"1.0.0","generated_at":"2026-07-19T16:15:00Z","epistemic_status":"conjectural",
  "conjectures":[
    {"id":"conj:portfolio-collapse","title":"Closure pressure may collapse the hypothesis portfolio","source_ids":["src:9324ca1dc67e70b8","src:e2671eb8dd4821d6"],"source_mechanism":"Optimization for visible impact can concentrate attention while curiosity policies allocate exploration against unresolved uncertainty.","target_mechanism":"An autonomous research loop optimizing closure alone may repeatedly select near-term tractable conjectures and narrow its source and hypothesis distribution.","analogy_map":["scientist topic choice → conjecture selection","citation impact → closure reward","field breadth → source-domain and mechanism diversity"],"disanalogies":["Scientific careers have social incentives absent from a single research loop","Synaplex can explicitly measure and constrain its portfolio"],"competing_explanations":["Narrowing reflects genuine source availability","Lower diversity is temporary specialization with higher later transfer"],"falsifiers":["Source-domain and mechanism diversity stays stable or rises under increased closure pressure after controlling for available sources"],"preconditions":["Versioned selection policy","Stable diversity metric","Comparable source-availability windows"],"expected_information_gain":"High: separates productive focus from self-reinforcing epistemic collapse.","observation_route":"Retrospective shadow scoring of registered candidates under alternative attention policies; any Evidence requires a preregistered Claim and frozen gate.","diversity_score":0.96,"novelty_score":0.82,"redundancy_score":0.12,"source_quality_score":0.87},
    {"id":"conj:stage-capability","title":"Research-loop capability must be measured by stage, not prose quality","source_ids":["src:3a7e24f19d4a81af","src:78904823f90c89e5","src:cbb9188f4f64ea57"],"source_mechanism":"Operational scientific agents can answer domain questions while failing at physical action, correction, or stage transitions; feedback analysis distinguishes local correction from whole-system capability.","target_mechanism":"A strong synthesis may conceal failures in retrieval, registration, execution, interpretation, or publication.","analogy_map":["laboratory stages → knowledge-loop stages","physical action failure → typed transition failure","feedback limits → bounded reflection and repair"],"disanalogies":["Software stages are more replayable than physical experiments","Physical instruments introduce noise absent from deterministic validators"],"competing_explanations":["Stage failures are interface defects rather than capability defects","End-to-end success is dominated by one bottleneck"],"falsifiers":["Stage-specific scores add no predictive value over synthesis quality for end-to-end completion"],"preconditions":["Typed stage events","Independent stage oracles","Held-out end-to-end tasks"],"expected_information_gain":"High: locates whether fluent interpretation is masking broken transitions.","observation_route":"Score archived internal cycles stage by stage without changing outcomes; any Evidence requires a preregistered Claim and frozen gate.","diversity_score":0.88,"novelty_score":0.76,"redundancy_score":0.18,"source_quality_score":0.94},
    {"id":"conj:lov-for-systems","title":"Leave-one-variable-out tests may falsify diagnostic system models","source_ids":["src:22a3e907ec8e8834","src:15706c04a748f182"],"source_mechanism":"LOVO tests whether a learned causal structure predicts relationships involving a withheld variable; replicated systems expose explicit state and transition relationships.","target_mechanism":"Withholding one telemetry variable or dependency edge can test whether a proposed failure account predicts the missing relation.","analogy_map":["causal variable → telemetry channel","withheld variable → hidden subsystem edge","cross-validation error → diagnostic-model prediction failure"],"disanalogies":["Telemetry variables are selected, not naturally sampled","Distributed-system transitions may violate causal-discovery assumptions"],"competing_explanations":["Failure comes from measurement sparsity","The withheld edge is redundant under the model"],"falsifiers":["LOVO prediction performs no better than a topology-naive baseline across registered incidents"],"preconditions":["Frozen graph hypothesis","Lossless event archive","Predeclared withheld variables"],"expected_information_gain":"Medium-high: can reject an appealing diagnostic model without causal ground truth.","observation_route":"Replay immutable incident traces with predeclared telemetry masks; any Evidence requires a preregistered Claim and frozen gate.","diversity_score":0.91,"novelty_score":0.86,"redundancy_score":0.08,"source_quality_score":0.94},
    {"id":"conj:typed-expert-constraints","title":"Expert interventions should enter as typed graph constraints","source_ids":["src:3b70d9477106c9f1","src:b4bee22a6d8992da"],"source_mechanism":"Expert-in-loop discovery makes domain constraints explicit; secure development frameworks require traceable decisions and provenance.","target_mechanism":"Principal corrections may be more reliable when represented as scoped, reviewable constraints instead of unstructured prompt residue.","analogy_map":["expert edge constraint → principal scope constraint","causal graph revision → Programme mechanism revision","decision provenance → constraint receipt"],"disanalogies":["Principal authority is governance, not causal expertise","Some corrections concern values rather than graph structure"],"competing_explanations":["Structured constraints add bureaucracy without reducing recurrence","Prompt-level examples are sufficient for durable behavior"],"falsifiers":["Typed constraints do not reduce repeated requirement-invention or boundary-collapse regressions"],"preconditions":["Constraint schema","Conflict and supersession rules","Regression-event baseline"],"expected_information_gain":"High: tests whether governance corrections become durable machine-checkable state.","observation_route":"Shadow-classify historical corrections into typed constraints and compare recurrence detection; any Evidence requires a preregistered Claim and frozen gate.","diversity_score":0.9,"novelty_score":0.8,"redundancy_score":0.15,"source_quality_score":0.96}
  ]
}
